{
  "schema_version": 1,
  "project": "WARP",
  "stage": "2P-E-B-PREBUILT",
  "record_type": "binary-audit-gate-record-template",
  "status": "PENDING",
  "note": "SOMENTE template. Deve permanecer EM BRANCO e reutilizavel. Nao preencher este .example.json. O registro real futuro de um gate devera ser criado em diretorio separado, com schema proprio/estritamente validado, com identidade/autoridade/canal/data vindos de entrada humana. Um template autoriza NO MAXIMO um gate; nao ha autorizacao transitiva; STOP_PATH e sempre possivel; o merge do template NAO autoriza o gate.",
  "plan_ref": {
    "path": "client/warp-audit/binary-audit-plan.example.json"
  },
  "gate_id": null,
  "gate_name": null,
  "decision": null,
  "decider": null,
  "role": null,
  "authority": null,
  "channel": null,
  "date": null,
  "justification": null,
  "conditions": null,
  "evidence_required": null,
  "authorization_scope": "single-gate",
  "authorizations": {
    "human_decision_required": true,
    "human_decision_received": false,
    "gate_authorized": false,
    "stop_path_selected": false,
    "provenance_reconfirmation_authorized": false,
    "materialization_authorized": false,
    "hashing_authorized": false,
    "static_inspection_authorized": false,
    "local_security_scan_authorized": false,
    "external_reputation_upload_authorized": false,
    "sandbox_creation_authorized": false,
    "execution_without_client_authorized": false,
    "client_copy_provision_authorized": false,
    "execution_with_client_copy_authorized": false,
    "patch_review_authorized": false,
    "patch_application_authorized": false,
    "client_preparation_authorized": false,
    "vps_access_authorized": false,
    "test_account_authorized": false,
    "first_login_authorized": false,
    "distribution_authorized": false
  },
  "supersedes": null,
  "rollback": null,
  "notes": null
}
